{
  "$schema": "https://raw.githubusercontent.com/WYCM9527/Design-System/main/design-system-adopter/schema/design-system.schema.json",
  "id": "citrine",
  "name": "Citrine 黄晶",
  "version": "2.12.1",
  "description": "公司级中后台设计系统：品牌黄唯一焦点 + 冷灰骨架，亮 / 暗两模式，桌面端（≥ 1280px）。",
  "upstream": {
    "repo": "WYCM9527/Design-System",
    "path": "citrine/seeds/brand-yellow-e",
    "tagPrefix": "citrine-v",
    "npm": "@wycm9527/citrine"
  },
  "docs": {
    "design": "design-system/DESIGN.md",
    "changelog": "CHANGELOG.md",
    "readme": "README.md"
  },
  "stacks": {
    "element-plus": {
      "label": "Vue 3 + Element Plus",
      "entry": "bridge/element-plus.css",
      "extra": [
        "bridge/iconpark.css",
        "bridge/recipes.css"
      ],
      "components": "bridge/vue",
      "snippet": "templates/entry-element.css",
      "notes": "templates/notes-element.md",
      "scaffold": "npm create vite@latest <name> -- --template vue && cd <name> && npm i element-plus @icon-park/vue-next vue-router echarts",
      "kitchen": "bridge/vue/KitchenSink.vue",
      "detect": {
        "deps": [
          "element-plus"
        ]
      }
    },
    "shadcn": {
      "label": "React + Tailwind v4 + shadcn/ui",
      "entry": "bridge/shadcn.css",
      "extra": [
        "bridge/recipes.css"
      ],
      "components": "bridge/react",
      "snippet": "templates/entry-shadcn.css",
      "notes": "templates/notes-shadcn.md",
      "scaffold": "npm create vite@latest <name> -- --template react-ts && cd <name> && npm i lucide-react echarts && npm i -D tailwindcss @tailwindcss/vite",
      "kitchen": "templates/KitchenSink.tsx",
      "detect": {
        "deps": [
          "class-variance-authority",
          "shadcn"
        ],
        "files": [
          "components.json"
        ]
      }
    }
  },
  "accept": {
    "npm": "@wycm9527/citrine-tools",
    "command": "citrine-accept all",
    "configTemplate": "templates/accept.config.mjs"
  },
  "export": {
    "note": "纯 CSS 交付（第三条渠道）：非 Node 项目（Flask / Django / PHP 模板等）用 ds.mjs export --to <static 目录> 得到下面的文件，按 core 的顺序 <link>，项目自己的样式放在之后、只引用变量；桥接按需 --with。运行时不需要 Node。",
    "core": [
      "design-system/dist/index.css",
      "bridge/recipes.css"
    ],
    "optional": {
      "element-plus": [
        "bridge/element-plus.css",
        "bridge/iconpark.css"
      ],
      "shadcn": [
        "bridge/shadcn.css"
      ]
    },
    "usage": "<link rel=\"stylesheet\" href=\"index.css\">   <!-- token（亮）+ 暗色 delta；<html class=\"dark\"> 切暗色 -->\n<link rel=\"stylesheet\" href=\"recipes.css\"> <!-- 页面骨架公共类（.app/.sidebar/.nav/.page-head/.filter/.status/.act/.form-grid/.stats…），与组件库无关 -->\n<link rel=\"stylesheet\" href=\"你的样式.css\"> <!-- 只引用 var(--color-*) / var(--spacing-*) 等变量，不写色值与像素 -->"
  },
  "migration": {
    "roles": "migration/roles.json",
    "guide": "README.md#从旧规范迁移按角色对照不按色值找近似"
  },
  "agents": "templates/AGENTS.md",
  "build": {
    "tool": "style-dictionary@5.5.2",
    "steward": "design-system-steward"
  },
  "owned": [
    "design-system/DESIGN.md",
    "design-system/style-dictionary.config.mjs",
    "design-system/scope-map.json",
    "design-system/theme-map.json",
    "design-system/tokens/**",
    "design-system/themes/**"
  ]
}
